route_link,route
https://www.redbus.in/bus-tickets/gangtok-to-siliguri,Gangtok to Siliguri
https://www.redbus.in/bus-tickets/siliguri-to-gangtok,Siliguri to Gangtok
https://www.redbus.in/bus-tickets/siliguri-to-rangpo,Siliguri to Rangpo
https://www.redbus.in/bus-tickets/rangpo-to-siliguri,Rangpo to Siliguri
https://www.redbus.in/bus-tickets/siliguri-to-pelling-sikkim,Siliguri to Pelling (Sikkim)
https://www.redbus.in/bus-tickets/pelling-sikkim-to-siliguri,Pelling (Sikkim) to Siliguri
https://www.redbus.in/bus-tickets/ravangla-sikkim-to-siliguri,Ravangla (Sikkim) to Siliguri
https://www.redbus.in/bus-tickets/siliguri-to-jorethang-sikkim,Siliguri to Jorethang (Sikkim)
https://www.redbus.in/bus-tickets/singtham-sikkim-to-siliguri,Singtham (Sikkim) to Siliguri
https://www.redbus.in/bus-tickets/siliguri-to-singtham-sikkim,Siliguri to Singtham (Sikkim)
https://www.redbus.in/bus-tickets/siliguri-to-namchi-sikkim,Siliguri to Namchi (Sikkim)
https://www.redbus.in/bus-tickets/siliguri-to-ravangla-sikkim,Siliguri to Ravangla (Sikkim)
https://www.redbus.in/bus-tickets/jorethang-sikkim-to-siliguri,Jorethang (Sikkim) to Siliguri
https://www.redbus.in/bus-tickets/namchi-sikkim-to-siliguri,Namchi (Sikkim) to Siliguri
https://www.redbus.in/bus-tickets/siliguri-to-melli-sikkim,Siliguri to Melli (Sikkim)
